{
  "schema_version": "0.1.0",
  "routing_version": "tau3-routing-v0.1.0",
  "policy_snapshot_version": "0.1.0",
  "source": {
    "policy_snapshots_path": "results/tau3/policy_packet/task_policy_snapshots.jsonl",
    "policy_snapshots_sha256": "b023b331056ddce79231f3244b06cc4723922ce2610ba6adc671171831a309de",
    "clause_inventory_path": "policies/tau3-policy-clause-inventory-v0.md",
    "clause_inventory_sha256": "b15e141e8fc756cf1e34f6b88d7cc16c4c3f5f0572f3ad878b3ccd8ac87c7d6c",
    "snapshot_count": 100,
    "unique_clause_count": 114,
    "trajectory_outcomes_used": false,
    "native_reward_used": false,
    "benchmark_review_used": false
  },
  "fallback_policy": {
    "missing_required_evidence": "unknown",
    "deterministic_parse_failure": "unknown",
    "judge_schema_failure": "unknown",
    "judge_citation_failure": "unknown",
    "deterministic_to_llm_fallback_allowed": false
  },
  "summary": {
    "assessment_routes": {
      "deterministic": 59,
      "hybrid": 12,
      "llm_judge": 43
    },
    "applicability_modes": {
      "deterministic": 69,
      "llm_judge": 45
    },
    "outcome_modes": {
      "deterministic": 61,
      "llm_judge": 53
    }
  },
  "entries": [
    {
      "clause_id": "airline.goal.task_outcome",
      "clause_type": "goal",
      "policy_applicability": "always",
      "description": "task source에 명시된 요청, 조건과 수용 가능한 대안을 모두 만족하는 terminal outcome을 달성한다.",
      "evidence_sources": [
        "task source",
        "final state",
        "tool results",
        "agent messages"
      ],
      "assessment_route": "hybrid",
      "applicability": {
        "mode": "deterministic",
        "procedure_id": "ses.constant_applicable.v1",
        "required_evidence_sources": [],
        "missing_evidence_result": "unknown",
        "rationale": "policy snapshot marks the clause as always applicable",
        "parameters": {
          "value": "applicable"
        }
      },
      "outcome": {
        "mode": "llm_judge",
        "procedure_id": "tau3-semantic-judge-v0.1.0.outcome",
        "required_evidence_sources": [
          "task source",
          "final state",
          "tool results",
          "agent messages"
        ],
        "missing_evidence_result": "unknown",
        "rationale": "the decision requires semantic interpretation of dialogue, grounding, scope, or policy context",
        "parameters": {}
      }
    },
    {
      "clause_id": "airline.invariant.baggage_add_only",
      "clause_type": "invariant",
      "policy_applicability": "conditional",
      "description": "checked bag을 제거하지 않는다",
      "evidence_sources": [
        "final state",
        "initial"
      ],
      "assessment_route": "deterministic",
      "applicability": {
        "mode": "deterministic",
        "procedure_id": "tau3.det.airline.invariant.baggage_add_only.applicability.v1",
        "required_evidence_sources": [
          "final state",
          "initial"
        ],
        "missing_evidence_result": "unknown",
        "rationale": "the policy predicate is executable from structured trajectory/tool evidence",
        "parameters": {
          "predicate": "source-grounded structured predicate",
          "clause_id": "airline.invariant.baggage_add_only"
        }
      },
      "outcome": {
        "mode": "deterministic",
        "procedure_id": "tau3.det.airline.invariant.baggage_add_only.outcome.v1",
        "required_evidence_sources": [
          "final state",
          "initial"
        ],
        "missing_evidence_result": "unknown",
        "rationale": "the policy predicate is executable from structured trajectory/tool evidence",
        "parameters": {
          "predicate": "source-grounded structured predicate",
          "clause_id": "airline.invariant.baggage_add_only"
        }
      }
    },
    {
      "clause_id": "airline.invariant.booking_passenger_limit",
      "clause_type": "invariant",
      "policy_applicability": "conditional",
      "description": "passenger 수가 5명 이하이다",
      "evidence_sources": [
        "final state",
        "tool args"
      ],
      "assessment_route": "deterministic",
      "applicability": {
        "mode": "deterministic",
        "procedure_id": "tau3.det.airline.invariant.booking_passenger_limit.applicability.v1",
        "required_evidence_sources": [
          "final state",
          "tool args"
        ],
        "missing_evidence_result": "unknown",
        "rationale": "the policy predicate is executable from structured trajectory/tool evidence",
        "parameters": {
          "predicate": "source-grounded structured predicate",
          "clause_id": "airline.invariant.booking_passenger_limit"
        }
      },
      "outcome": {
        "mode": "deterministic",
        "procedure_id": "tau3.det.airline.invariant.booking_passenger_limit.outcome.v1",
        "required_evidence_sources": [
          "final state",
          "tool args"
        ],
        "missing_evidence_result": "unknown",
        "rationale": "the policy predicate is executable from structured trajectory/tool evidence",
        "parameters": {
          "predicate": "source-grounded structured predicate",
          "clause_id": "airline.invariant.booking_passenger_limit"
        }
      }
    },
    {
      "clause_id": "airline.invariant.booking_payment_cardinality",
      "clause_type": "invariant",
      "policy_applicability": "conditional",
      "description": "certificate ≤1, credit card ≤1, gift card ≤3이다",
      "evidence_sources": [
        "final state",
        "tool args"
      ],
      "assessment_route": "deterministic",
      "applicability": {
        "mode": "deterministic",
        "procedure_id": "tau3.det.airline.invariant.booking_payment_cardinality.applicability.v1",
        "required_evidence_sources": [
          "final state",
          "tool args"
        ],
        "missing_evidence_result": "unknown",
        "rationale": "the policy predicate is executable from structured trajectory/tool evidence",
        "parameters": {
          "predicate": "source-grounded structured predicate",
          "clause_id": "airline.invariant.booking_payment_cardinality"
        }
      },
      "outcome": {
        "mode": "deterministic",
        "procedure_id": "tau3.det.airline.invariant.booking_payment_cardinality.outcome.v1",
        "required_evidence_sources": [
          "final state",
          "tool args"
        ],
        "missing_evidence_result": "unknown",
        "rationale": "the policy predicate is executable from structured trajectory/tool evidence",
        "parameters": {
          "predicate": "source-grounded structured predicate",
          "clause_id": "airline.invariant.booking_payment_cardinality"
        }
      }
    },
    {
      "clause_id": "airline.invariant.booking_shared_itinerary",
      "clause_type": "invariant",
      "policy_applicability": "conditional",
      "description": "모든 passenger가 같은 flight와 cabin을 이용한다",
      "evidence_sources": [
        "final state"
      ],
      "assessment_route": "deterministic",
      "applicability": {
        "mode": "deterministic",
        "procedure_id": "tau3.det.airline.invariant.booking_shared_itinerary.applicability.v1",
        "required_evidence_sources": [
          "final state"
        ],
        "missing_evidence_result": "unknown",
        "rationale": "the policy predicate is executable from structured trajectory/tool evidence",
        "parameters": {
          "predicate": "source-grounded structured predicate",
          "clause_id": "airline.invariant.booking_shared_itinerary"
        }
      },
      "outcome": {
        "mode": "deterministic",
        "procedure_id": "tau3.det.airline.invariant.booking_shared_itinerary.outcome.v1",
        "required_evidence_sources": [
          "final state"
        ],
        "missing_evidence_result": "unknown",
        "rationale": "the policy predicate is executable from structured trajectory/tool evidence",
        "parameters": {
          "predicate": "source-grounded structured predicate",
          "clause_id": "airline.invariant.booking_shared_itinerary"
        }
      }
    },
    {
      "clause_id": "airline.invariant.booking_uniform_cabin",
      "clause_type": "invariant",
      "policy_applicability": "conditional",
      "description": "reservation의 모든 flight cabin class가 같다",
      "evidence_sources": [
        "final state"
      ],
      "assessment_route": "deterministic",
      "applicability": {
        "mode": "deterministic",
        "procedure_id": "tau3.det.airline.invariant.booking_uniform_cabin.applicability.v1",
        "required_evidence_sources": [
          "final state"
        ],
        "missing_evidence_result": "unknown",
        "rationale": "the policy predicate is executable from structured trajectory/tool evidence",
        "parameters": {
          "predicate": "source-grounded structured predicate",
          "clause_id": "airline.invariant.booking_uniform_cabin"
        }
      },
      "outcome": {
        "mode": "deterministic",
        "procedure_id": "tau3.det.airline.invariant.booking_uniform_cabin.outcome.v1",
        "required_evidence_sources": [
          "final state"
        ],
        "missing_evidence_result": "unknown",
        "rationale": "the policy predicate is executable from structured trajectory/tool evidence",
        "parameters": {
          "predicate": "source-grounded structured predicate",
          "clause_id": "airline.invariant.booking_uniform_cabin"
        }
      }
    },
    {
      "clause_id": "airline.invariant.cancel_eligibility",
      "clause_type": "invariant",
      "policy_applicability": "conditional",
      "description": "24시간 이내, airline cancellation, business, covered insurance 중 하나가 참이다",
      "evidence_sources": [
        "initial state",
        "tool action"
      ],
      "assessment_route": "deterministic",
      "applicability": {
        "mode": "deterministic",